{
  "schema_version": "v1",
  "heuristic_version": "v2",
  "description": "Sidecar: modeling_kind per unit_id; heuristic until LLM/re-extract pass (v2: chunk body TOC signals)",
  "kinds_distribution": {
    "definition_candidate": 165,
    "editorial_or_credit": 1,
    "toc_or_nav_noise": 215,
    "narrative_example": 83,
    "mechanic_rule": 8,
    "domain_rule_candidate": 229,
    "variation_rule": 19,
    "behavioral_interaction": 5
  },
  "units": {
    "unit_00001": {
      "modeling_kind": "definition_candidate",
      "heuristic_rule": "evidence_type",
      "schema_version": "v1",
      "heuristic_version": "v2"
    },
    "unit_00003": {
      "modeling_kind": "editorial_or_credit",
      "heuristic_rule": "section_path editorial",
      "schema_version": "v1",
      "heuristic_version": "v2"
    },
    "unit_00015": {
      "modeling_kind": "toc_or_nav_noise",
      "heuristic_rule": "toc pattern + short span",
      "schema_version": "v1",
      "heuristic_version": "v2"
    },
    "unit_00017": {
      "modeling_kind": "toc_or_nav_noise",
      "heuristic_rule": "toc pattern + short span",
      "schema_version": "v1",
      "heuristic_version": "v2"
    },
    "unit_00019": {
      "modeling_kind": "toc_or_nav_noise",
      "heuristic_rule": "toc pattern + short span",
      "schema_version": "v1",
      "heuristic_version": "v2"
    },
    "unit_00025": {
      "modeling_kind": "toc_or_nav_noise",
      "heuristic_rule": "toc pattern + short span",
      "schema_version": "v1",
      "heuristic_version": "v2"
    },
    "unit_00027": {
      "modeling_kind": "toc_or_nav_noise",
      "heuristic_rule": "toc pattern + short span",
      "schema_version": "v1",
      "heuristic_version": "v2"
    },
    "unit_00029": {
      "modeling_kind": "toc_or_nav_noise",
      "heuristic_rule": "body toc/nav pattern (body_toc_score=1.00)",
      "schema_version": "v1",
      "heuristic_version": "v2"
    },
    "unit_00038": {
      "modeling_kind": "toc_or_nav_noise",
      "heuristic_rule": "toc pattern + short span",
      "schema_version": "v1",
      "heuristic_version": "v2"
    },
    "unit_00043": {
      "modeling_kind": "toc_or_nav_noise",
      "heuristic_rule": "body toc/nav pattern (body_toc_score=1.00)",
      "schema_version": "v1",
      "heuristic_version": "v2"
    },
    "unit_00048": {
      "modeling_kind": "toc_or_nav_noise",
      "heuristic_rule": "toc pattern + short span",
      "schema_version": "v1",
      "heuristic_version": "v2"
    },
    "unit_00056": {
      "modeling_kind": "toc_or_nav_noise",
      "heuristic_rule": "toc pattern + short span",
      "schema_version": "v1",
      "heuristic_version": "v2"
    },
    "unit_00078": {
      "modeling_kind": "toc_or_nav_noise",
      "heuristic_rule": "body toc/nav pattern (body_toc_score=1.00)",
      "schema_version": "v1",
      "heuristic_version": "v2"
    },
    "unit_00080": {
      "modeling_kind": "toc_or_nav_noise",
      "heuristic_rule": "toc pattern + short span",
      "schema_version": "v1",
      "heuristic_version": "v2"
    },
    "unit_00086": {
      "modeling_kind": "toc_or_nav_noise",
      "heuristic_rule": "body toc/nav pattern (body_toc_score=1.00)",
      "schema_version": "v1",
      "heuristic_version": "v2"
    },
    "unit_00088": {
      "modeling_kind": "toc_or_nav_noise",
      "heuristic_rule": "toc pattern + short span",
      "schema_version": "v1",
      "heuristic_version": "v2"
    },
    "unit_00090": {
      "modeling_kind": "toc_or_nav_noise",
      "heuristic_rule": "toc pattern + short span",
      "schema_version": "v1",
      "heuristic_version": "v2"
    },
    "unit_00092": {
      "modeling_kind": "toc_or_nav_noise",
      "heuristic_rule": "toc pattern + short span",
      "schema_version": "v1",
      "heuristic_version": "v2"
    },
    "unit_00094": {
      "modeling_kind": "toc_or_nav_noise",
      "heuristic_rule": "body toc/nav pattern (body_toc_score=1.00)",
      "schema_version": "v1",
      "heuristic_version": "v2"
    },
    "unit_00096": {
      "modeling_kind": "toc_or_nav_noise",
      "heuristic_rule": "toc pattern + short span",
      "schema_version": "v1",
      "heuristic_version": "v2"
    },
    "unit_00098": {
      "modeling_kind": "toc_or_nav_noise",
      "heuristic_rule": "body toc/nav pattern (body_toc_score=1.00)",
      "schema_version": "v1",
      "heuristic_version": "v2"
    },
    "unit_00104": {
      "modeling_kind": "toc_or_nav_noise",
      "heuristic_rule": "toc pattern + short span",
      "schema_version": "v1",
      "heuristic_version": "v2"
    },
    "unit_00106": {
      "modeling_kind": "toc_or_nav_noise",
      "heuristic_rule": "body toc/nav pattern (body_toc_score=1.00)",
      "schema_version": "v1",
      "heuristic_version": "v2"
    },
    "unit_00108": {
      "modeling_kind": "toc_or_nav_noise",
      "heuristic_rule": "toc pattern + short span",
      "schema_version": "v1",
      "heuristic_version": "v2"
    },
    "unit_00159": {
      "modeling_kind": "narrative_example",
      "heuristic_rule": "examples region or evidence_type",
      "schema_version": "v1",
      "heuristic_version": "v2"
    },
    "unit_00161": {
      "modeling_kind": "mechanic_rule",
      "heuristic_rule": "evidence_type",
      "schema_version": "v1",
      "heuristic_version": "v2"
    },
    "unit_00163_merged": {
      "modeling_kind": "definition_candidate",
      "heuristic_rule": "evidence_type",
      "schema_version": "v1",
      "heuristic_version": "v2"
    },
    "unit_00167": {
      "modeling_kind": "definition_candidate",
      "heuristic_rule": "evidence_type",
      "schema_version": "v1",
      "heuristic_version": "v2"
    },
    "unit_00169": {
      "modeling_kind": "definition_candidate",
      "heuristic_rule": "evidence_type",
      "schema_version": "v1",
      "heuristic_version": "v2"
    },
    "unit_00171": {
      "modeling_kind": "domain_rule_candidate",
      "heuristic_rule": "default domain-rule",
      "schema_version": "v1",
      "heuristic_version": "v2"
    },
    "unit_00177": {
      "modeling_kind": "mechanic_rule",
      "heuristic_rule": "evidence_type",
      "schema_version": "v1",
      "heuristic_version": "v2"
    },
    "unit_00197": {
      "modeling_kind": "domain_rule_candidate",
      "heuristic_rule": "default domain-rule",
      "schema_version": "v1",
      "heuristic_version": "v2"
    },
    "unit_00208": {
      "modeling_kind": "narrative_example",
      "heuristic_rule": "examples region or evidence_type",
      "schema_version": "v1",
      "heuristic_version": "v2"
    },
    "unit_00220": {
      "modeling_kind": "domain_rule_candidate",
      "heuristic_rule": "default domain-rule",
      "schema_version": "v1",
      "heuristic_version": "v2"
    },
    "unit_00222_merged": {
      "modeling_kind": "definition_candidate",
      "heuristic_rule": "evidence_type",
      "schema_version": "v1",
      "heuristic_version": "v2"
    },
    "unit_00228": {
      "modeling_kind": "toc_or_nav_noise",
      "heuristic_rule": "body toc/nav pattern (body_toc_score=0.50)",
      "schema_version": "v1",
      "heuristic_version": "v2"
    },
    "unit_00230": {
      "modeling_kind": "toc_or_nav_noise",
      "heuristic_rule": "body toc/nav pattern (body_toc_score=0.50)",
      "schema_version": "v1",
      "heuristic_version": "v2"
    },
    "unit_00232": {
      "modeling_kind": "toc_or_nav_noise",
      "heuristic_rule": "body toc/nav pattern (body_toc_score=0.50)",
      "schema_version": "v1",
      "heuristic_version": "v2"
    },
    "unit_00234": {
      "modeling_kind": "mechanic_rule",
      "heuristic_rule": "evidence_type",
      "schema_version": "v1",
      "heuristic_version": "v2"
    },
    "unit_00246": {
      "modeling_kind": "toc_or_nav_noise",
      "heuristic_rule": "body toc/nav pattern (body_toc_score=0.50)",
      "schema_version": "v1",
      "heuristic_version": "v2"
    },
    "unit_00248": {
      "modeling_kind": "domain_rule_candidate",
      "heuristic_rule": "default domain-rule",
      "schema_version": "v1",
      "heuristic_version": "v2"
    },
    "unit_00250": {
      "modeling_kind": "domain_rule_candidate",
      "heuristic_rule": "default domain-rule",
      "schema_version": "v1",
      "heuristic_version": "v2"
    },
    "unit_00252": {
      "modeling_kind": "toc_or_nav_noise",
      "heuristic_rule": "body toc/nav pattern (body_toc_score=0.50)",
      "schema_version": "v1",
      "heuristic_version": "v2"
    },
    "unit_00264": {
      "modeling_kind": "narrative_example",
      "heuristic_rule": "examples region or evidence_type",
      "schema_version": "v1",
      "heuristic_version": "v2"
    },
    "unit_00266": {
      "modeling_kind": "toc_or_nav_noise",
      "heuristic_rule": "body toc/nav pattern (body_toc_score=0.50)",
      "schema_version": "v1",
      "heuristic_version": "v2"
    },
    "unit_00268": {
      "modeling_kind": "toc_or_nav_noise",
      "heuristic_rule": "body toc/nav pattern (body_toc_score=1.00)",
      "schema_version": "v1",
      "heuristic_version": "v2"
    },
    "unit_00270": {
      "modeling_kind": "toc_or_nav_noise",
      "heuristic_rule": "body toc/nav pattern (body_toc_score=1.00)",
      "schema_version": "v1",
      "heuristic_version": "v2"
    },
    "unit_00280": {
      "modeling_kind": "domain_rule_candidate",
      "heuristic_rule": "default domain-rule",
      "schema_version": "v1",
      "heuristic_version": "v2"
    },
    "unit_00282": {
      "modeling_kind": "domain_rule_candidate",
      "heuristic_rule": "default domain-rule",
      "schema_version": "v1",
      "heuristic_version": "v2"
    },
    "unit_00291": {
      "modeling_kind": "toc_or_nav_noise",
      "heuristic_rule": "body toc/nav pattern (body_toc_score=1.00)",
      "schema_version": "v1",
      "heuristic_version": "v2"
    },
    "unit_00306": {
      "modeling_kind": "domain_rule_candidate",